Exchange,Ticker,Company Name,Description,Website,Logo
NYMEX,CL,light-crude,"Light Sweet Crude Oil Futures Contract offers participants the opportunity to trade one of the world's most liquid oil commodities in an electronic marketplace. The contract not only brings the benefits of electronic trading a US light sweetcrude maker, but also brings together the world's three most significant oil benchmarks on a single exchange: Brent, Middle East Sour Crude and WTI. This offers a reduction in collateral requirements through the offsetting of margins.",http://www.cmegroup.com/trading/energy/crude-oil/light-sweet-crude.html,
NYMEX,QM,miny-crude-oil-futures,"Crude oil is a naturally-occurring substance found in certain rock formations in the earth. To extract the maximum value from crude, it needs to be refined into petroleum products. The best-known of these is gasoline, or petrol. Others include liquefied petroleum gas (LPG), naphtha, kerosene, gas oil and fuel oil.Oil wells are used to release the oil from within the earth. Some of the earliest developed oil wells were drilled in China using bamboo poles. These oil wells were developed in 347 A.D. for the sole purpose of providing enough fuel to create a thriving salt industry. By the 1950s, crude oil became a global energy source, which in effect killed the whaling industry by making whale oil obsolete.",http://www.cmegroup.com/trading/energy/crude-oil/emini-crude-oil_contractSpecs_futures.html,
NYMEX,QU,miny-gasoline-futures,MiNY Gasoline futures are traded on the New York Mercantile Exchange under ticker symbol QU in U.S. cents per gallon.,http://www.cmegroup.com/trading/energy/refined-products/rbob-gasoline_contractSpecs_futures.html,
ICE,QH,miny-heating-oil-futures,"Heating oil is a refined byproduct of crude oil. After crude oil is broken down during the refinement process, it is separated into heating oil. Similar to diesel oil, heating oil's official name is No. 2 fuel oil.The use of heating oil gained ground with the invention of the oil burner in the 1920s. Until then, homes were heated by coal. Coal was messy, expensive, and required ample storage space and extensive manual labor on the part of the user. Conversely, heating oil freed up basement space and reduced pollution in the home - no soot or ash to contend with on furniture, clothing, and worse, in lungs. What's more, when heating oil is burned, a room thermostat can easily regulate heat to a consistent temperature. (These options represent one of the most important political commodities. Read more in Fueling Futures In The Energy Market.)While heating oil contracts are used to hedge against price fluctuation in jet fuel and diesel, they are essentially different products and adhere to their own quality standards.",https://www.theice.com/products/27066804/Heating-Oil-1st-Line-Mini-Future,https://upload.wikimedia.org/wikipedia/commons/4/4b/New_York_Mercantile_Exchange_logo.svg
NYMEX,QG,miny-natural-gas-futures,MiNY Natural Gas futures are traded on the New York Mercantile Exchange under ticker symbol QG in U.S. dollars and cents per mmBtu.,http://www.cmegroup.com/trading/energy/natural-gas/emini-natural-gas_contractSpecs_futures.html,
NYMEX,NG,natural-gas-futures,"Natural gas is used extensively throughout the U.S. to heat homes, and also has important applications in commercial and industrial settings. It is similar to what is referred to as biogas, which is methane produced from the breakdown of organic matter. Because it is a fossil fuel, it contains many secondary products that must be filtered out of the methane to render it commercially viable. Ethane, propane, butane, helium and hydrogen sulfide are removed and are considered a secondary income source for refiners.Once considered an ineffective byproduct of oil production, natural gas is steadily finding a foothold in today's world. Economical, environmentally friendly and efficient, natural gas is the cleanest-burning fossil fuel, and technologies are improving the way it is captured, transported and distributed.According to statistics published in 2009 by the Federal Energy Regulatory Commission, 96% of the world's natural gas reserves reside outside of the U.S., yet 25% of the country's energy comes from natural gas.",http://www.cmegroup.com/trading/energy/nymex-natural-gas-futures.html,
NYMEX,PN,propane-futures,"Propane is produced as a by-product of two other processes, natural gas processing and petroleum refining. The processing of natural gas involves removal of butane, propane, and large amounts of ethane from the raw gas, in order to prevent condensation of these volatiles in natural gas pipelines. Additionally, oil refineries produce some propane as a by-product of cracking petroleum into gasoline or heating oil.Propane is one of a group of liquefied petroleum gases (LP gases). The others include butane, propylene, butadiene, butylene, isobutylene and mixtures thereof.",http://www.cmegroup.com/trading/energy/petrochemicals/mont-belvieu-physical-ldh-propane-opis_contract_specifications.html,
NYMEX,RB,rbob-gasoline-futures,RBOB Gasoline futures are traded on the New York Mercantile Exchange under ticker symbol RB in U.S. dollars and cents per gallon.,http://www.cmegroup.com/trading/energy/refined-products/rbob-gasoline_contractSpecs_futures.html,
NYMEX,HZ,singapore-380cst-fuel-oil-futures,Singapore 380cst Fuel Oil futures are traded on the New York Mercantile Exchange under ticker symbol HZ in U.S. dollars and cents per metric ton.,http://www.cmegroup.com/trading/energy/refined-products/singapore-380cst-fuel-oil-platts-swap-futures_contract_specifications.html,
NYMEX,UX,uranium,"Uranium is a metal whose most well known commercial use is as fuel for nuclear power plants, which provided around 16% of the world's electricity in 2007.(Other uses include counterweights for helicopters, ammunition and radiation shields. The exact use depends on the specific isotope.) Nuclear power is slowly making a comeback as an electricity source of choice in the U.S. market. At the middle of 2009, the U.S. Nuclear Regulatory Commission (NRC) had received 17 applications for combined construction and operating licenses (COL) for 26 new nuclear reactors.[2] Also, in June of 2009 there was evidence of growing U.S. government support; the Energy Department said it would invest $18.5 billion in federal loan guarantees to four U.S. firms to help build a new generation of nuclear reactors.",http://www.cmegroup.com/trading/metals/other/uranium_contractSpecs_futures.html,
NYMEX,TT,cotton,"King Cotton has been around for thousands of years. Independently discovered in both the Old World and New World, no other commodity has created more controversy, built more nations, enriched more lives and caused more suffering. Extensively cultivated in India for 6,000 years, cotton became the darling of the British Empire via the Dutch East India Company during the 18th century.As slavery began to take root in the U.S., cheaper and heartier cotton from the South began to supplement and later replace Indian cotton. This coincided with Britain's desire to de-industrialize India's cotton industry and expand its own during the 19th century.",http://www.cmegroup.com/trading/agricultural/softs/cotton.html,
NYMEX,AL,aluminum,"Aluminium or aluminum (in North American English) is a chemical element in the boron group with symbol Al and atomic number 13. It is a silvery-white, soft, nonmagnetic, ductile metal. Aluminium is the third most abundant element in the Earth's crust (after oxygen and silicon) and its most abundant metal. Aluminium makes up about 8% of the crust by mass, though it is less common in the mantle below. Aluminium metal is so chemically reactive that native specimens are rare and limited to extreme reducing environments. Instead, it is found combined in over 270 different minerals. The chief ore of aluminium is bauxite.",http://www.cmegroup.com/trading/metals/base/aluminum_contractSpecs_futures.html,
NYMEX,QT,asian-palladium-futures,"Palladium is a chemical element with symbol Pd and atomic number 46. It is a rare and lustrous silvery-white metal discovered in 1803 by William Hyde Wollaston. He named it after the asteroid Pallas, which was itself named after the epithet of the Greek goddess Athena, acquired by her when she slew Pallas. Palladium, platinum, rhodium, ruthenium, iridium and osmium form a group of elements referred to as the platinum group metals (PGMs). These have similar chemical properties, but palladium has the lowest melting point and is the least dense of them.More than half the supply of palladium and its congener platinum is used in catalytic converters, which convert as much as 90% of the harmful gases in automobile exhaust (hydrocarbons, carbon monoxide, and nitrogen dioxide) into less noxious substances (nitrogen, carbon dioxide and water vapor). Palladium is also used in electronics, dentistry, medicine, hydrogen purification, chemical applications, groundwater treatment, and jewelry. Palladium is a key component of fuel cells, which react hydrogen with oxygen to produce electricity, heat, and water.",http://www.cmegroup.com/trading/metals/precious/platinum-palladium-spread_contractSpecs_options.html,
NYMEX,QR,asian-platinum-futures,"Platinum was a part of Native American culture before Columbus arrived in the New World. In 1557, Julius Caesar Scaliger writes about the metal, referencing the platinum mines of Panama and Mexico and the difficulty of melting the metal based on the technology of the times. Europeans realized early on that platinum was more precious than gold. King Louis XV of France acknowledged platinum's rarity and declared it the only metal fit for a king.During the 19th century, platinum was very difficult to metalsmith. It was often mixed with iridium in order to mold it into jewelry. Around the turn of the 20th century, Russia made several significant platinum deposit discoveries and began to produce 90% of the world's platinum. At the same time, advances in metalsmithing made the use of pure platinum more common.Platinum's metallic properties make it highly attractive in a variety of commercial and industrial applications. It has a high resistance to temperature and does not oxidize in air, although it is corroded by halogens, cyanides, sulfur and caustic alkalis. What's more, it is also non-reactive to chemical attack and has excellent electrical properties. (All that glitters isn't gold. Find out how to get started on your treasure hunt in A Beginner's Guide To Precious Metals.)",http://www.cmegroup.com/trading/metals/precious/platinum.html,
NYMEX,HG,copper-futures,"Copper is a metal that has been known all around the world since ancient times. From West Africa to China to Europe to Central and South America, copper has been mined and worked continuously from as far back as 8,700 BC. As one of the few independently occurring metals, copper has been used in a multitude of forms, from prehistoric pendants to modern-day piping and more.As a highly versatile material, copper can conduct electricity and is a necessary trace mineral in all living things. It also possesses the ability to destroy germs on contact. Copper is mined in large open pits, and Chile and the U.S. have extensive reserves that could be exhausted within the next 50 years. The New York Mercantile Exchange (NYMEX), where copper contracts are traded, states that copper is the third most widely used metal in the world.",http://www.cmegroup.com/trading/metals/base/copper_contractSpecs_futures.html,
NYMEX,QC,copper-miny-futures,"Copper is a chemical element with symbol Cu (from Latin: cuprum) and atomic number 29. It is a soft, malleable and ductile metal with very high thermal and electrical conductivity. A freshly exposed surface of pure copper has a reddish-orange color. It is used as a conductor of heat and electricity, as a building material and as a constituent of various metal alloys, such as sterling silver used in jewelry, cupronickel used to make marine hardware and coins and constantan used in strain gauges and thermocouples for temperature measurement.Copper is found as a pure metal in nature, and this was the first source of the metal to be used by humans, c. 8000 BC. It was the first metal to be smelted from its ore, c. 5000 BC, the first metal to be cast into a shape in a mold, c. 4000 BC and the first metal to be purposefully alloyed with another metal, tin, to create bronze, c. 3,500 BC.",http://www.cmegroup.com/trading/metals/base/emini-copper_contractSpecs_futures.html,
NYMEX,QO,miny-gold-futures,"Gold is a chemical element with the symbol Au (from Latin: aurum) and the atomic number 79. In its purest form, it is a bright, slightly reddish yellow, dense, soft, malleable and ductile metal. Chemically, gold is a transition metal and a group 11 element. It is one of the least reactive chemical elements, and is solid under standard conditions. The metal therefore occurs often in free elemental (native) form, as nuggets or grains, in rocks, in veins and in alluvial deposits. It occurs in a solid solution series with the native element silver (as electrum) and also naturally alloyed with copper and palladium. Less commonly, it occurs in minerals as gold compounds, often with tellurium (gold tellurides).Gold's atomic number of 79 makes it one of the higher atomic number elements that occur naturally in the universe. It is thought to have been produced in supernova nucleosynthesis and from the collision of neutron stars[4] and to have been present in the dust from which the Solar System formed. Because the Earth was molten when it was just formed, almost all of the gold present in the early Earth probably sank into the planetary core. Therefore, most of the gold that is present today in the Earth's crust and mantle is thought to have been delivered to Earth later, by asteroid impacts during the Late Heavy Bombardment, about 4 billion years ago.",http://www.cmegroup.com/trading/metals/precious/e-mini-gold_contractSpecs_futures.html,
NYMEX,PA,palladium-futures,"Palladium is one of the rarest metals on earth, about 15 times more rare than platinum and 30 times more rare than gold. Belonging to the platinum group of metals, around 80% of the world's palladium production comes from two countries: Russia and South Africa. In fact, Russia alone accounts for roughly half of the world's production, which is estimated to be 200,000 ounces per year. This can create cause for concern as any decrease in exports from these countries can contribute to volatility in palladium prices.In comparison to platinum, palladium shares similar chemical properties but is less dense and has a lower melting point.",http://www.cmegroup.com/trading/metals/precious/palladium_contract_specifications.html?optionExpiration=U7,
NYMEX,PL,platinum-futures,"Platinum's metallic properties make it highly attractive in a variety of commercial and industrial applications. It has a high resistance to temperature and does not oxidize in air, although it is corroded by halogens, cyanides, sulfur and caustic alkalis. What's more, it is also non-reactive to chemical attack and has excellent electrical properties.",https://www.cmegroup.com/trading/metals/precious/platinum_contract_specifications.html,
NYMEX,QI,silver-miny-futures,"Silver is the metallic element with the atomic number 47. Its symbol is Ag, from the Latin argentum, derived from the Greek ὰργὀς (literally ""shiny"" or ""white""), and ultimately from a Proto-Indo-European language root reconstructed as *h2erǵ-, ""grey"" or ""shining"". A soft, white, lustrous transition metal, it exhibits the highest electrical conductivity, thermal conductivity, and reflectivity of any metal. The metal is found in the Earth's crust in the pure, free elemental form (""native silver""), as an alloy with gold and other metals, and in minerals such as argentite and chlorargyrite. Most silver is produced as a byproduct of copper, gold, lead, and zinc refining.Silver has long been valued as a precious metal. Silver metal is used in many premodern monetary systems in bullion coins, sometimes alongside gold: while it is more abundant than gold, it is much less abundant as a native metal. Its purity is typically measured on a per-mille basis; a 94%-pure alloy is described as ""0.940 fine"". As one of the seven metals of antiquity, silver has had an enduring role in most human cultures.",http://www.cmegroup.com/trading/metals/precious/silver_contractSpecs_futures.html,
NYMEX,UX,uranium-futures,Uranium futures are traded on the New York Mercantile Exchange under ticker symbol UX in U.S. dollars and cents per pound.,http://www.cmegroup.com/trading/metals/other/uranium_contractSpecs_futures.html,
CME,DB,butter-futures,"Butter futures reflect cash market supply, demand and cold storage stocks fundamental information, and offer spread trade opportunities as butter is placed in storage for the holiday (seasonal) demand period. Butter futures contracts offer both hedgers and traders a storable product to trade. Storable contracts create spreading opportunities between deliverable contract months. As the supply and demand for the cash product changes, the need arises for the butter industry to store product or take product out of storage. This movement creates pricing relationship differences between the nearest contract month and the most distant ones.",http://www.cmegroup.com/trading/agricultural/dairy/cash-settled-butter_contractSpecs_futures.html,
CME,DA,dairy,CME Group Dairy contracts provide participants of the $48 billion U.S. dairy business a useful tool in managing the price risks inherent to this industry. This fact card provides a quick overview of who uses these contracts and why. It also provides the contract specifications you need to start trading.,http://www.cmegroup.com/trading/agricultural/dairy-fact-card.html,https://upload.wikimedia.org/wikipedia/en/b/bb/Cme-group-logo.PNG
CME,DY,dry-whey-futures,"Dry Whey futures are cash-settled futures that are traded exclusively on the CME Globex electronic trading platform. Whey is the liquid that separates from milk during the cheesemaking process. Dried whey, which is high in protein and low in fat, is used in foods such as crackers, breads and cereal, as well as energy bars and protein drinks. It is also used in animal feed. Contract settlement is pegged to the USDA monthly weighted average price in the United States for dry whey as first released.The contract provides price volatility, price transparency and growing liquidity, as well as innumerable choices for spreading.",http://www.cmegroup.com/trading/agricultural/dairy/dry-whey.html,
CME,GF,feeder-cattle-futures,"Feeder cattle are weaned calves that have been raised to a certain weight and then sent to feedlots to be fattened before they are slaughtered. On average, three to four months is required to fatten the cattle from a starting weight of 600-800 pounds to the desired finished weight of 1,000-1,300 pounds.Raising cattle for beef consumption occurs throughout the world. Roughly 1.3 billion heads of cattle are currently being raised worldwide, with no decrease in sight. The number of cattle brought into feedlots provides the best estimation of whether the near future will produce a glut or a shortage of live cattle.",http://www.cmegroup.com/trading/agricultural/livestock/feeder-cattle_contract_specifications.html?exchange=CEE&sector=FX&clearingCode=,
CME,LH,lean-hogs-futures,"Lean Hog is a type of hog (pork) that can be easily traded in mercantile and option exchanges. This type of hog is the source of the majority of the pork meat in the US.Lean Hog futures and options are traded on the Chicago Mercantile Exchange (CME). The contracts are for 40,000 pounds of Lean Hogs, and call for cash settlement based on the lean hog index. The lean hog index is a two-day weighted average of cash markets.",https://www.cmegroup.com/trading/agricultural/livestock/lean-hogs_contract_specifications.html?exchange=&sector=EQUITY+INDEX&clearingCode=GI,
CME,NF,nonfat-dry-milk-futures,"Nonfat dry milk is a product of the manufacturing of butter; it can be stored, used in various feed and food sources and/or reconstituted into milk. Nonfat Dry Milk futures contracts broaden the scope for dairy industry trading as the product readily trades worldwide.",http://www.cmegroup.com/trading/agricultural/dairy/nonfat-dry-milk_contract_specifications.html,
NYBOT,CT,cotton-futures,Contract calls for physical delivery of cotton of certain minimum standards of basis grade and staple length.,https://www.theice.com/products/254/Cotton-No-2-Futures,https://www.rithmic.com/images/logo_nybot.gif
CME,LB,lumber-futures,"The standardization of lumber in the U.S. can be directly traced back to the first and second World Wars. While logging had endured for centuries, it was not until World War I that standard lumber sizes were instituted. The significant amount of lumber that was required during World War II solidified the acceptance of standardized sizes because it provided an efficient way for mills and lumber purchasers to meet each other's needs while being separated by thousands of miles.Although lumber has many versatile uses, it is constantly subjected to changing consumer interests, shifts in manufacturing facilities and housing downturns. This leaves the industry in a constant state of panic because it is forced to be reactionary to various factors outside of its control. To protect the lumber industry from the volatile price swings that this uncertainty brings, the Chicago Mercantile Exchange (CME) developed the first lumber commodities contract in 1969.",http://www.cmegroup.com/trading/agricultural/grain-and-oilseed/oats_contractSpecs_options.html?optionProductId=2499#optionProductId=2499,
ICE,OJ,orange-juice-futures,"For 4,000 years, oranges have grown in Southeast Asia and China. The orange made its way to Europe during the Moorish occupation of Spain, eventually arriving in the New World. From these humble beginnings, a thriving orange industry has developed in both the U.S. and Brazil.Prior to 1947, the traditional form of consumption for orange juice was fresh-squeezed; therefore, the commercial orange juice industry was constantly contending with the highly perishable nature of freshly squeezed oranges. Often, supply shocks were both quick and severe. The invention of frozen concentrated orange juice (FCOJ) in 1947 brought a new standard to the orange juice industry, opening the gates to an international marketplace that was not readily available before.Until 1962, Florida dominated the orange juice export market. However, because of severe freezes and hurricanes throughout the years, it has been overtaken by Brazil, the world's leading FCOJ exporter in 2009. In the last 30 years, Brazil's dominance in the international market has become so complete that it represents 80% of all global exports. Brazil even supplies the U.S. with 30-50% of its orange juice.",https://www.theice.com/products/30/specs,https://upload.wikimedia.org/wikipedia/en/thumb/9/93/Ice_logo.svg/1024px-Ice_logo.svg.png