Exchange,Ticker,Company Name,Description,Website,Logo
CBOT,ZC,corn,"Corn is the most widely produced feed grain in the United States, accounting for more than 90 percent of total production. Around 80 million acres of land are planted with corn. The majority of the crop is used as livestock feed; the remainder is processed into a multitude of food and industrial products including starch, sweeteners such as high fructose corn syrup, corn oil, and ethanol for use as a fuel. As corn prices rise, agricultural companies stand to benefit as their corn or corn seeds command a higher price in the market. Companies who buy corn or derivative products such as high fructose corn syrup can be hit with much larger costs when corn prices rise",http://www.cmegroup.com/trading/agricultural/grain-and-oilseed/corn_contractSpecs_options.html?optionProductId=2730#optionProductId=2730,http://agnews.dtn.com/images/E0010035/CBOTLogoFull-Medium.jpg
CBOT,ZO,oats,"Oats generally refers to seeds of the common oat plant, a cereal grain. Oats are consumed by humans in the form of oatmeal and rolled oats (as well as in dry cereal), however they are more commonly used as feed for livestock including cattle and poultry, as well as horses.",https://www.cmegroup.com/trading/agricultural/grain-and-oilseed/oats_contract_specifications.html?exchange=&sector=&clearingCode=C,http://agnews.dtn.com/images/E0010035/CBOTLogoFull-Medium.jpg
CBOT,ZS,soybeans,"The United States grows more soybeans than any other country in the world, accounting for 32% of the world's production. Its fields yield 2,585 million bushels of soybeans every year. [1] Farmers in the rest of the world are closing the gap, however, enticed by a continued rise in soybean prices. In 1980 the U.S. it produced 60 percent of the world's soybeans, but by 2005 it produced only 39%. [2].Despite increased world supply, the price of soybean futures has increased more than 80% in 2008 because of soybean oil's use in biodiesel and as feed for fish farming. Another factor in soybeans' rise is China's urbanization, as Chinese cities buy large quantities of tofu and other soy products. [3] [4] As soybean prices rise, agricultural companies benefit, while companies that use soybean products and derivatives face higher production costs.",https://www.cmegroup.com/trading/agricultural/grain-and-oilseed/soybean_contract_specifications.html?exchange=&sector=EQUITY+INDEX&clearingCode=70,http://agnews.dtn.com/images/E0010035/CBOTLogoFull-Medium.jpg
CBOT,ZW,wheat,"Wheat is a commodity input that goes into many food products, from pasta to bread to baked sweets. Wheat futures on Chicago's commodities exchange more than doubled in September 2007 compared to the previous year, going from $3.95 a bushel to nearly $9. What's driving up wheat prices is a matter of simple supply and demand, as bad weather, including a spate of hurricanes, have created shortages of this important grain.A more fundamental problem compounding the recent effects of bad weather is that farmers are increasingly switching to grow corn because of the skyrocketing demand for the ethanol-producing grain.",http://www.cmegroup.com/trading/agricultural/grain-and-oilseed/kc-wheat_contract_specifications.html,http://agnews.dtn.com/images/E0010035/CBOTLogoFull-Medium.jpg
NYMEX,HG,copper,"Copper is a metal used extensively as a heat and electrical conductor, as well as a component in metal alloys, most notably brass and bronze. Annual world production is projected to 18.4 million metric tons in 2008.[1]Copper is used extensively for electrical wiring and plumbing in buildings. A good overview on the use of copper can be found on the webpage of the International Wrought Copper Council (IWCC).Copper is known to have antimicrobial properties. It is also an important nutrient. It is widely believed that copper jewelry can help wearer conquer diseases.",http://www.cmegroup.com/trading/metals/base/copper_contractSpecs_futures.html,https://upload.wikimedia.org/wikipedia/commons/4/4b/New_York_Mercantile_Exchange_logo.svg
NYMEX,GC,gold,"Gold is one of the most highly-sought after precious metals in the world. It is used in jewelry, electronics, and coinage. Gold is widely considered to be an effective hedge against inflation, which means that when the dollar depreciates, demand for gold increases. In addition, during times of economic and political uncertainty, the demand for Gold rises due to its high intrinsic value and relative stability. Moreover, the introduction of gold ETFs and the increasing wealth in emerging markets, such as China, India, and Latin America have contributed to rising demand for gold. While demand for gold has been rising, supply has been dropping as many of the top gold producing countries have had decreasing production over the past few years.Gold has been used as money for more than 3,500 years as it doubles as a currency and a store of value. Gold is one of very few assets that is not the obligation of someone else. It has also proven to be a good hedge as inflation since the experiments with unbacked fiat money began in Europe and the USA in the 18th century",http://www.cmegroup.com/trading/metals/precious/gold_contractSpecs_futures.html,https://upload.wikimedia.org/wikipedia/commons/4/4b/New_York_Mercantile_Exchange_logo.svg
NYMEX,PL,platinum,"Platinum is an exceedingly rare, silvery-white precious metal used in jewelry making, electronics components and various industrial applications. About half of all global platinum consumption is for the manufacture of automobile catalytic converters. [1]Platinum is exceedingly rare (about 30 times rarer than gold) and found in only a few deposits worldwide. The largest known primary reserves are in South Africa's Bushweld complex, followed by deposits near Norilsk, Russia and the Sudbury Basin, Canada.",http://www.cmegroup.com/trading/metals/precious/gold-platinum_contractSpecs_futures.html,https://upload.wikimedia.org/wikipedia/commons/4/4b/New_York_Mercantile_Exchange_logo.svg
NYMEX,SI,silver,"Silver is a precious metal that is used in a wide array of industrial applications as well as in jewelry and photographic film. Industrial applications (for example computers, cell phones, TV, batteries, pharmaceuticals) made up about 54% of the world’s silver fabrication demand in 2007.[1] As a whole, demand for silver has been growing faster than annual production since 1990,[2]and silver inventory has dropped 98% from 1942 to 2004, 5.9 billion oz to 115 million oz, respectively.[3] Silver is even more scarce than gold as the above ground supply of silver was about 5x less than that of gold in 2006.[4] The effect of the falling supply of silver coupled with increasing demand from the US economic slowdown has lifted silver prices to their highest point since 1981 (2007 average silver price = $13.38 /oz).",http://www.cmegroup.com/trading/metals/precious/silver_contractSpecs_futures.html,https://upload.wikimedia.org/wikipedia/commons/4/4b/New_York_Mercantile_Exchange_logo.svg
ICE,RS,canola-futures,The canola futures contract is the world benchmark for canola trading. The contract prices physical delivery of canola seed free-on-board trucks or rail cars in the par delivery region in Central Saskatchewan,https://www.theice.com/products/251/Canola-Futures,http://www.logosurfer.com/sites/default/files/styles/large/public/IntercontinentalExchange.jpg?itok=7teLGy-F
CBOT,ZC,corn-futures,"Corn is among the most versatile and complex grains in the world, and corn production and distribution has changed the face of history. With 270 million metric tons of corn produced annually in the U.S. alone, corn could be considered the most important grain crop on the planet.",https://www.cmegroup.com/trading/agricultural/grain-and-oilseed/corn_contract_specifications.html?exchange=&sector=&clearingCode=YK,
CBOT,ZR,rice-futures,"rice is used to describe rice as it comes from the field after harvest. Whether birthed from Indian soil by Vishnu, carried to the Chinese on the tail of a dog or incarnated as the Emperor of Japan, rice is recognized as an integral part of the most populous countries in the world. Rice was first sown, harvested and distributed across Southeast Asia and Central Asia in the second millennium B.C., migrating to Europe in the eighth century A.D. and then to the Americas during the 16th and 17th centuries.Today, rice constitutes one of the top three staple foods of the world. Consumption in both China and India translates directly into weak exports. Only a small percentage of the total global production of rice is truly available for international trade, which leaves small rice-producing countries such as Thailand, Vietnam and the U.S. in the forefront as net rice exporters.",http://www.cmegroup.com/trading/agricultural/grain-and-oilseed/rough-rice_contractSpecs_options.html?underlyingFutureContract=14X7&optionProductId=337&optionExpiration=337-N7&strikeRange=Active#optionProductId=337,
CBOT,BS,south-american-soybean-futures,soybean future is a soybeans bought or sold at an agreed price for delivery at a specified future date.,http://www.cmegroup.com/education/featured-reports/south-american-sdnc-soybean-options.html,
CBOT,CS,soybean-crush-futures,"Soybean crush futures contracts are traded on the Chicago Board of Trade under ticker symbol CS and are delivered every year in January, February, March, May, July, August, September, October, November, December.",http://www.cmegroup.com/trading/agricultural/grain-and-oilseed/oats_contractSpecs_options.html?optionProductId=1755&optionExpiration=&action=Submit#optionProductId=1755,
CBOT,ZS,soybean-futures,"First introduced in Europe in the 1700s, the soybean has become one of the most important beans in the world, securing a place for itself by providing oil and protein around the world. With applications as diversified as vegetable oil, animal feed and foodstuffs, it is no wonder that soybeans have become staples in countries far from its original roots in Eastern Asia.Fifty-five percent of the world's soybean production occurs in the Americas. The U.S. exports 37% of the world's soybeans. Originally considered merely an industrial product before the 1920s, soybeans rose to popularity for human consumption during World War II and have had a significant impact on U.S. farming. In 2007, soybeans brought in a total of $26.8 billion.",http://www.cmegroup.com/trading/agricultural/grain-and-oilseed/oats_contractSpecs_options.html?optionProductId=1755&optionExpiration=&action=Submit#optionProductId=1755,
CBOT,ZM,soybean-meal-futures,"Soybean Meal futures are traded on the Chicago Board of Trade under ticker symbol SM in dollars and cents per short ton. For electronic trading sessions, the symbol ZM is used.",https://www.cmegroup.com/trading/agricultural/grain-and-oilseed/soybean-meal_contract_specifications.html?exchange=&sector=&clearingCode=MKW,
CBOT,ZL,soybean-oil-futures,"Soybean Oil futures are traded on the Chicago Board of Trade under ticker symbol BO in cents per pound. For electronic trading sessions, the symbol ZL is used.",https://www.cmegroup.com/trading/agricultural/grain-and-oilseed/soybean-oil_contract_specifications.html?exchange=&sector=AGRICULTURE&clearingCode=14,
CBOT,ZW,wheat-futures,"Common and durum wheat are the main types. Among common wheat, the main varieties are spring and winter, hard and soft, and red and white. At the national level, different varieties should be reported separately, reflecting their different uses. Used mainly for human food.",http://www.cmegroup.com/trading/agricultural/grain-and-oilseed/kc-wheat_contract_specifications.html,
NYMEX,AL,aluminum-futures,"COMEX Aluminum futures were traded on the COMEX division of the NYMEX under ticker symbol AL in U.S. cents per pound, until the COMEX delisted aluminum futures in september 2009.",http://www.cmegroup.com/trading/metals/base/aluminum_contractSpecs_futures.html,
NYMEX,QS,asian-gold,"From the time of the Egyptian Pharaohs to the voyage of Columbus to the New World and beyond, gold has been revered as a symbol of wealth and prosperity. Gold has also been used as currency and as a way to prop up the fiat money of various countries. One of the most significant moves to gold- and silver-backed currency occurred in 1792, which was the year that the U.S. put the dollar on the gold and silver standard.One-hundred and seventy-nine years later, in 1971, the U.S. was removed from the gold standard by President Richard Nixon. This fundamental economic shift had a tremendous impact on the price of gold around the globe. Approximately eight years later, on January 21, 1980, gold prices catapulted from a low of $35/ounce to a record high of $850/ounce, or $2,398.21 when adjusted for inflation. On March 19, 2008, gold hit a high of $1,022.40.",http://www.cmegroup.com/trading/metals/precious/gold_contract_specifications.html,
NYMEX,GC,gold-futures,COMEX Gold futures are traded on the COMEX division of the NYMEX under ticker symbol GC in U.S dollars and cents per troy ounce.,http://www.cmegroup.com/trading/metals/precious/gold_contract_specifications.html,
NYMEX,HR,hrc-steel-futures,"Hot rolled coiled steel is used in the construction and automotive industries for the manufacture of pipes, vehicle parts and other engineering applications. Sheet metal, guard rails and railroad tracks are also commonly made from it. HRC steel futures trade under the symbol ""HR"" on all applicable markets and are recorded in United States dollars.",http://www.cmegroup.com/trading/metals/ferrous/hrc-steel_contract_specifications.html,
NYMEX,SI,silver-futures,COMEX Silver futures are traded on the COMEX division of the NYMEX under ticker symbol SI in U.S. cents per troy ounce.,http://www.cmegroup.com/trading/metals/precious/silver_contractSpecs_futures.html,
NYBOT,CC,cocoa-futures,"The Cocoa contract is the world benchmark for the global cocoa market. The contract prices the physical delivery of exchange-grade product from a variety of African, Asian and Central and South American origins to any of five US delivery ports.",https://www.theice.com/products/7/Cocoa-Futures,https://www.rithmic.com/images/logo_nybot.gif
NYBOT,KC,coffee-futures,"In 1457, Kiva Han, the predecessor to today's trendy coffee shops, opened its doors in Constantinople. It brought from obscurity a well-liked but little-known beverage, coffee, to the world. Originally cultivated in the hills of Ethiopia for thousands of years, the little brown bean developed a following in the Ottoman Empire for religious purposes. Eventually, its popularity throughout the West gained it a reputation as the preferred drink of sultans and kings.If you're a coffee drinker, you can appreciate the effect that coffee can have on your body's chemistry. It has a similar chemical molecule makeup to adenosine, the fatigue molecule that your body produces. However, instead of adenosine bonding to tired cells, the caffeine in coffee is recognized by the cells and an entirely new chemical reaction occurs. The body ignores the adenosine and in a panic reaction, the brain releases adrenaline into the blood stream, creating a feeling of alertness and excitement that makes coffee a popular choice in overcoming fatigue. (Stick to your budget every day with the 15 simple tips in Squeeze A Greenback Out Of Your Latte.)",https://www.theice.com/products/15/Coffee-C-Futures,https://upload.wikimedia.org/wikipedia/commons/4/4b/New_York_Mercantile_Exchange_logo.svg
NYMEX,TT,nymex-cotton-futures,Cotton futures are traded on the New York Mercantile Exchange under ticker symbol TT in dollars and cents per pound.,http://www.cmegroup.com/trading/agricultural/softs/cotton.html,
NYBOT,SB,sugar,"Commercial sugar's origins date as far back as fourth-century India. While the Indians discovered a way to crystallize sugar, the Moors discovered a way to perfect it. With the development of sugar mills and refineries, sugar became a successful commodity in the Muslim world.In the 14th century, the Moors brought sugar growth and production to the Iberian Peninsula, and plantations were set up throughout what is now known as Spain and Portugal. These regions inherited the legacy of sugar manufacturing once the Moorish empire was successfully driven out of the Iberian Peninsula by King Ferdinand and Queen Isabella of Spain. Eventually, Portugal successfully brought sugar to the New World, and by the 16th century there were more than 3,000 sugar mills throughout South America.The refined table sugar we consider a staple was once so rare and expensive that it was referred to as ""white gold."" Sugar cane, which was the first source of sugar, is a perennial grass that is grown in tropical and subtropical areas (before the arrival of sugar cane, honey and fruit were the only common sweeteners). Later, the development of an alternative source of sugar was discovered: beets. The sugar derived from these two sources is 99.8% pure sucrose, which is a complex sugar composed of glucose and fructose. Today, sugar can be found throughout the world, with over 120 countries successfully producing it for domestic and international use. (From sugar beet to sugar cane, this sector is growing despite a lot of sour challenges. Find out more in Sugar: A Sweet Deal For Investors.)",https://www.theice.com/products/23/Sugar-No-11-Futures,https://www.rithmic.com/images/logo_nybot.gif
CME,LE,live-cattle-futures,"Live Cattle refers to cattle (cows) that have reached the requisite weight for slaughter. This is different from feeder cattle, which are the younger animals that are still in the process of being fed into fished ""fed"" cattle.Live Cattle futures are traded on the Chicago Mercantile Exchange under ticker symbol LC in cents per pound. For electronic trading sessions, the symbol LE is used.",https://www.cmegroup.com/trading/agricultural/livestock/live-cattle_contract_specifications.html?amp%3Bexchange=CME,
NYMEX,YO,sugar-no-11-futures,"Sugar No. 11 futures are traded on the New York Board of Trade under ticker symbol SB in cents and hundredths of a cent per pound.The ""Number 11"" in the contract refers the way shipping costs are handled between the buyer and the seller of the contract. Sugar #11 is sold ""Free on Board (FOB)"", which means the seller pays to ship the sugar to a port, and is responsible for loading costs. The buyer, however, is responsible for unloading costs.",http://www.cmegroup.com/trading/agricultural/softs/sugar-no11_contract_specifications.html,
NYMEX,CJ,cocoa,"With a scientific name like Theobroma, which means ""food of the gods,"" it's no wonder that the world can't seem to get enough cocoa. The origins of the cocoa plant can be traced back thousands of years. Discovered during the early exploration of the Americas, cocoa successfully spread across Europe in the 1600s as sweeteners and flavorings were added.Originally a bitter beverage for the royal court of the Mayan empire, cocoa production has become an international industry. Today, cocoa trees are predominantly grown in West Africa, primarily processed in the Netherlands and the U.S., and cocoa is consumed in one form or another by every country in the world.",http://www.cmegroup.com/europe/products/agricultural/softs/physically-delivered-cocoa_contractSpecs_futures.html,
CBOT,ZW,kansas-city-wheat-futures,"Kansas City Wheat Futures (alternately referred to as ""KC Wheat,"" ""KCBT Wheat,"" ""Hard Red Winter Wheat,"" and ""HRW Wheat"") are traded on the Kansas City Board of Trade (KCBT) under ticker symbol KW in cents per bushel.For electronic trading sessions, the symbol KE is used.",http://www.cmegroup.com/trading/agricultural/grain-and-oilseed/kc-wheat_contract_specifications.html,
CBOT,XC,mini-sized-corn-futures,"Mini-Corn futures are traded on the Chicago Board of Trade under ticker symbol YC in cents per bushel. For electronic trading sessions, the symbol XC is used.",https://www.cmegroup.com/trading/agricultural/grain-and-oilseed/mini-sized-corn_contract_specifications.html?deliveryMonth=U7&timeSlot=20160829%3A2,
CBOT,XK,mini-sized-soybean-futures,"Mini-Soybean futures are traded on the Chicago Board of Trade under ticker symbol YK in cents per bushel. For electronic trading sessions, the symbol XK is used.",http://www.cmegroup.com/trading/agricultural/grain-and-oilseed/mini-sized-soybean_contract_specifications.html?exchange=CBT&sector=INTEREST+RATES&clearingCode=,
CBOT,XW,mini-sized-wheat-futures,"Mini-Sized Wheat Futures are traded on the Chicago Board of Trade (CBOT) under ticker symbol YW in cents per bushel.[1] For electronic trading sessions, the symbol XW is used.",https://www.cmegroup.com/trading/agricultural/files/mini-sized-kc-hrw-wheat-contract-specs.pdf,
CBOT,ZO,oats-futures,"A plant with open, spreading panicle-bearing large spikelets. Used primarily in breakfast foods. Makes excellent fodder for horses.Obtained by crushing or rolling the whole or broken grain; includes grains flaked, hulled or otherwise worked for human consumption.",https://www.cmegroup.com/trading/agricultural/grain-and-oilseed/oats_contract_specifications.html?exchange=&sector=&clearingCode=C,
CBOT,ZR,rice,Rice is a cereal grain and one of the most widely consumed foodstuffs throughout the world.,http://www.cmegroup.com/trading/agricultural/grain-and-oilseed/rough-rice_contractSpecs_options.html?underlyingFutureContract=14X6&optionProductId=337&optionExpiration=337-F7&strikeRange=ALL#optionProductId=337,
MGEX,MWE,spring-wheat-futures,spring wheat futures,http://www.mgex.com/spring_wheat.html,
ICE,AB,western-barley-futures,"The Barley contract prices physical delivery of feed barley free-on-board at elevators in Eastern Saskatchewan, with additional delivery points across the Canadian prairies.",https://www.theice.com/products/3912654/Barley-Futures,http://www.logosurfer.com/sites/default/files/styles/large/public/IntercontinentalExchange.jpg?itok=7teLGy-F
NYMEX,BZ,brent-crude,"Brent Crude (also known as Brent Blend, London Brent, and Brent petroleum) is a crude oil sourced from the North Sea (the region between the British Isles, mainland Europe, and Scandinavia). It is generally classified as a light, sweet crude blend, thereby making it easy to refine. It is however, not as light as light crude (often referred to as West Texas Intermediate to distinguish the somewhat confusing nomenclature).Brent Crude futures are traded on the New York Mercantile Exchange under ticker symbol BZ. Futures contracts are delivered every month of the year.",http://www.cmegroup.com/trading/energy/crude-oil/brent-crude-oil.html,
NYMEX,BB,brent-crude-oil-futures,Brent Crude Oil futures are traded on the New York Mercantile Exchange under ticker symbol SC in U.S. dollars and cents per barrel.,http://www.cmegroup.com/trading/energy/crude-oil/brent-crude-oil_contract_specifications.html,
NYMEX,CL,crude-oil-futures,Light Sweet Crude Oil futures are traded on the New York Mercantile Exchange under ticker symbol CL in U.S. dollars and cents per barrel.,http://www.cmegroup.com/trading/energy/crude-oil/light-sweet-crude_contractSpecs_futures.html,
NYMEX,JM,electricity-futures,Electricity futures are traded on the New York Mercantile Exchange under ticker symbol JM in U.S. dollars and cents per Mwh.,http://cmegroup.mediaroom.com/index.php?s=43&item=2759,
CBOT,EH,ethanol-futures,Ethanol futures are traded on the Chicago Board of Trade under ticker symbol AC in U.S dollars and cents per gallon.,https://www.cmegroup.com/trading/energy/ethanol/cbot-ethanol_contract_specifications.html?exchange=&sector=AGRICULTURE&clearingCode=,
NYMEX,RB,gasoline,Gasoline is a mixture of hydrocarbons used primarily in the fueling of internal combustion engines (e.g. automobile engines). Gasoline prices generally follow crude oil prices. The commodity trades on the NYMEX and is valued in US dollars per gallon.,http://www.cmegroup.com/trading/energy/refined-products/rbob-gasoline_contractSpecs_futures.html,
NYMEX,LU,gulf-coast-diesel-futures,Gulf Coast Diesel futures are traded on the New York Mercantile Exchange under ticker symbol LU in U.S. dollars and cents per barrel.,http://www.cmegroup.com/trading/energy/refined-products/gulf-coast-ultra-low-sulfur-diesel-ulsd-argus-calendar-swap_contract_specifications.html,
NYMEX,LR,gulf-coast-gasoline-futures,Gulf Coast Gasoline futures are traded on the New York Mercantile Exchange under ticker symbol LR in U.S dollars and cents per barrel.,http://www.cmegroup.com/trading/energy/refined-products/gulf-coast-cbob-gasoline-a2-platts-swap_contract_specifications.html,
NYMEX,HO,heating-oil,"Heating oil is a refined byproduct of crude oil. After crude oil is broken down during the refinement process, it is separated into heating oil. Similar to diesel oil, heating oil's official name is No. 2 fuel oil.The use of heating oil gained ground with the invention of the oil burner in the 1920s. Until then, homes were heated by coal. Coal was messy, expensive, and required ample storage space and extensive manual labor on the part of the user. Conversely, heating oil freed up basement space and reduced pollution in the home - no soot or ash to contend with on furniture, clothing, and worse, in lungs. What's more, when heating oil is burned, a room thermostat can easily regulate heat to a consistent temperature.",https://www.cmegroup.com/trading/energy/refined-products/gulf-coast-heating-oil-calendar-swap_contract_specifications.html,
NYMEX,HO,heating-oil-futures,A monthly cash settled future based on the daily settlement price for Heating Oil Futures.,https://www.cmegroup.com/trading/energy/refined-products/gulf-coast-heating-oil-calendar-swap_contract_specifications.html,
